updated_at,text,deleted_at,copied_at,autoset_others,id,value,element_definition_id,position,copied_from,created_at
Sun Nov 30 17:13:22 -0600 2008,Information about the family's socio-economic status and how it impacts the student's performance in school has not yet been considered.,,,false,909152276,1,837394825,2,,Mon Mar 10 11:05:54 -0500 2008
Sun Jan 04 15:06:57 -0600 2009,"The family provided some information about their socio-economic status and how it impacts the student's performance. 

The lack of a trusting relationship between school and home limits the information available.
",,,false,909152277,2,837394825,3,,Mon Mar 10 11:05:54 -0500 2008
Sun Jan 04 15:07:10 -0600 2009,"The family provided some information about their socio-economic status that may have impacted the student's performance in the past. 

Incomplete data is available about current status.  
",,,false,909152278,3,837394825,4,,Mon Mar 10 11:05:54 -0500 2008
Sun Nov 30 17:13:22 -0600 2008,There is consistent ongoing communication between the family and school about how socio-economic status impacts the student's performance in school.,,,false,909152279,4,837394825,5,,Mon Mar 10 11:05:54 -0500 2008
Sun Nov 30 17:13:22 -0600 2008,No information available at this time.,,,,909152280,0,837394826,1,,Mon Mar 10 11:05:54 -0500 2008
Sun Nov 30 17:13:22 -0600 2008,The student has not yet participated in interventions to reduce the impact of the family's socio-economic status on his/her success in school.  ,,,false,909152281,1,837394826,2,,Mon Mar 10 11:05:54 -0500 2008
Sun Nov 30 17:13:22 -0600 2008,The student has experienced some interventions to reduce the impact of the family's socio-economic status on his/her success in school.,,,false,909152282,2,837394826,3,,Mon Mar 10 11:05:54 -0500 2008
Sun Nov 30 17:13:22 -0600 2008,The student often experiences interventions to reduce the impact of the family's socio-economic status on his/her success in school.,,,false,909152283,3,837394826,4,,Mon Mar 10 11:05:54 -0500 2008
Sun Nov 30 17:13:22 -0600 2008,The student consistently experiences interventions to reduce the impact of the family's socio-economic status on his/her success in school.,,,false,909152284,4,837394826,5,,Mon Mar 10 11:05:54 -0500 2008
Sun Nov 30 17:13:22 -0600 2008,No information available at this time.,,,,909152285,0,837394827,1,,Mon Mar 10 11:05:54 -0500 2008
Sun Nov 30 17:13:22 -0600 2008,The family has not yet been provided with information about available community resources.,,,false,909152286,1,837394827,2,,Mon Mar 10 11:05:54 -0500 2008
Sun Nov 30 17:13:22 -0600 2008,The family has been provided with print material about available community resources. ,,,false,909152287,2,837394827,3,,Mon Mar 10 11:05:54 -0500 2008
Sun Jan 04 15:07:36 -0600 2009,"The family has received explanations about available community resources. 

Some assistance to help the family access community supports has been provided. 
",,,false,909152288,3,837394827,4,,Mon Mar 10 11:05:54 -0500 2008
Sun Jan 04 15:07:49 -0600 2009,"The family has received regular, direct assistance to access community supports.

Family, school and community work together to support the success of the student.
",,,false,909152289,4,837394827,5,,Mon Mar 10 11:05:54 -0500 2008
Sun Nov 30 17:13:22 -0600 2008,,,,,909152290,0,837394828,1,,Mon Mar 10 11:05:54 -0500 2008
